{
  "$schema": "../schema/author.schema.json",
  "id": "juan-gonzalez",
  "name": "Dr. Juan F. González",
  "avatarUrl": "assets/authors/juan-gonzalez.jpg",
  "aboutParagraphs": [
    "El Dr. Juan F. González es odontólogo y especialista en ortodoncia, graduado de la Universidad Tecnológica de México (UNITEC). Es docente de mecatrónica craneofacial en la Universidad del Valle (Colombia), instructor certificado de Blender for Dental y conferencista nacional e internacional en ortodoncia digital, con investigaciones publicadas en revistas como American Journal of Orthodontics, Ortodoncia Actual y Kieferorthopädie.",
    "Mantiene una práctica odontológica privada en Cuenca, Ecuador, y fundó Cursos Odonto 3D en 2021, una academia que ha formado a miles de profesionales de la odontología en todo el mundo en odontología digital: impresión 3D, guías quirúrgicas, diseño CAD/CAM y flujos de trabajo de laboratorio digital.",
    "En este catálogo, el Dr. González aporta dos plantillas para clínicas dentales, Asistente dental para pacientes en WhatsApp y Asistente dental para DMs de Instagram: el manual de recepción que su academia entrega a las clínicas, convertido en prompts."
  ],
  "socialLinks": [
    "https://www.instagram.com/cursosodonto3d/",
    "https://www.youtube.com/@CursosOdonto3D",
    "https://www.cursosodonto3d.com/"
  ]
}
