{
  "$schema": "../schema/author.schema.json",
  "id": "alejavi-rivera",
  "name": "Alejavi Rivera",
  "avatarUrl": "assets/authors/alejavi-rivera.jpg",
  "aboutParagraphs": [
    "A creator based in Spain who makes artificial intelligence practical in the day-to-day of a business. Alejavi's content gets to the point, with real use cases, and helps a fast-growing audience actually put AI to work.",
    "In this catalog, Alejavi contributed Local business DM assistant, which settles the routine questions arriving through Instagram on its own."
  ],
  "socialLinks": [
    "https://www.youtube.com/@alejavirivera",
    "https://www.instagram.com/alejavirivera/"
  ]
}
