{
  "$schema": "../schema/author.schema.json",
  "id": "roxana-falasco",
  "name": "Roxana Falasco",
  "avatarUrl": "assets/authors/roxana-falasco.jpg",
  "aboutParagraphs": [
    "One of the best-known educational content creators in the Spanish-speaking world, with over 500,000 subscribers on YouTube. Roxana teaches entrepreneurs and creators to use AI to build content, courses and personal brands faster.",
    "In this catalog, Roxana contributed Course signups by DM, which answers the program and price questions arriving through Instagram."
  ],
  "socialLinks": [
    "https://www.youtube.com/@RoxanaFalasco"
  ]
}
